{
  "TASK_ID": "R42-FIXTURE-READ-001",
  "PROJECT_ID": "ATELIER-PILOTE",
  "PHASE_ID": "R42-P2P3",
  "TASK_CLASS": "VALIDATION",
  "WORKLOAD_CLASS": "SOURCE_INSPECTION",
  "SOURCE_IDENTITY": {
    "KIND": "GIT",
    "LOCATOR": "github:neoflowcore/atelier-runtime"
  },
  "EXPECTED_HEAD": "2f82365b7270fd7b4cb15dcf4f87fe7e0e05f4d9",
  "EFFECT_CLASSES": [
    "READ_ONLY"
  ],
  "ALLOWED_SCOPE": [
    "repo:neoflowcore/atelier-runtime"
  ],
  "TOUCH_SET": [
    {
      "PATH": "schemas/runtime-contract.schema.json",
      "OPERATION": "READ"
    }
  ],
  "CAPABILITY_REQUIREMENTS": [
    "SOURCE_READ"
  ],
  "RESOURCE_REQUIREMENTS": {
    "EXECUTION_CLASS": "RUNTIME_DEFAULT",
    "OS_CLASS": "ANY",
    "ARCH_CLASS": "ANY",
    "WORKSPACE_CLASS": "READ_ONLY"
  },
  "NETWORK_CLASS": "NONE",
  "DATA_ACCESS_CLASS": "PUBLIC",
  "SECRET_CLASS": "NONE",
  "REMOTE_MUTATION_INTENT": "NONE",
  "HOST_OPERATION_INTENT": "NONE",
  "ORACLE_REQUIREMENT": "NONE",
  "ACCEPTANCE_REQUIREMENTS": [
    {
      "ID": "A1",
      "TEXT": "Readback is bound to the declared expected head."
    }
  ],
  "VERIFIER_REQUIREMENTS": [
    {
      "ID": "V1",
      "TEXT": "Verify no source mutation occurred."
    }
  ],
  "ECONOMY_BUDGET": {
    "MAX_EXECUTIONS": 1,
    "MAX_RETRIES": 0,
    "MAX_REPAIRS": 0,
    "MAX_PARALLELISM": 1
  },
  "INTERVENTION_POLICY": "BLOCK_ON_AMBIGUITY",
  "REPLAN_BOUNDARY": "TASK_ONLY",
  "EXPECTED_OUTPUTS": [
    {
      "ID": "O1",
      "TEXT": "Schema readback summary."
    }
  ],
  "EXPECTED_EVIDENCE": [
    {
      "ID": "E1",
      "TEXT": "Exact source identity and content digest/readback evidence."
    }
  ],
  "CONTRACT_VERSION": "1.0.0",
  "TASK_CONTRACT_HASH": "d2fb156b45cb2f78f97e1550b2c972ada5e739ae0477fdc2944cb8e5b23ddb66"
}
