{
  "TASK_ID": "R42-FIXTURE-CANDIDATE-WRITE-001",
  "PROJECT_ID": "ATELIER-PILOTE",
  "PHASE_ID": "R42-P2P3",
  "TASK_CLASS": "IMPLEMENTATION",
  "WORKLOAD_CLASS": "REPOSITORY_CHANGE",
  "SOURCE_IDENTITY": {
    "KIND": "GIT",
    "LOCATOR": "github:neoflowcore/atelier-runtime"
  },
  "EXPECTED_HEAD": "2f82365b7270fd7b4cb15dcf4f87fe7e0e05f4d9",
  "EFFECT_CLASSES": [
    "LOCAL_COMPUTE",
    "LOCAL_WORKSPACE_WRITE",
    "REMOTE_SOURCE_WRITE"
  ],
  "ALLOWED_SCOPE": [
    "path:src/example.ts",
    "repo:neoflowcore/example-target"
  ],
  "TOUCH_SET": [
    {
      "PATH": "src/example.ts",
      "OPERATION": "UPDATE"
    }
  ],
  "CAPABILITY_REQUIREMENTS": [
    "FILESYSTEM_READ",
    "FILESYSTEM_WRITE",
    "GIT_CANDIDATE_WRITE",
    "NETWORK_EGRESS",
    "PROCESS_EXEC",
    "SOURCE_READ"
  ],
  "RESOURCE_REQUIREMENTS": {
    "EXECUTION_CLASS": "SELF_HOSTED_REQUIRED",
    "OS_CLASS": "LINUX",
    "ARCH_CLASS": "X64",
    "WORKSPACE_CLASS": "ISOLATED_WRITABLE"
  },
  "NETWORK_CLASS": "ALLOWLIST_MUTATE",
  "DATA_ACCESS_CLASS": "PRIVATE_SOURCE",
  "SECRET_CLASS": "SOURCE_WRITE",
  "REMOTE_MUTATION_INTENT": "EXACT_APPROVAL_REQUIRED",
  "HOST_OPERATION_INTENT": "NONE",
  "ORACLE_REQUIREMENT": "NONE",
  "ACCEPTANCE_REQUIREMENTS": [
    {
      "ID": "A1",
      "TEXT": "Only the declared file may change."
    },
    {
      "ID": "A2",
      "TEXT": "Candidate write must not imply merge."
    }
  ],
  "VERIFIER_REQUIREMENTS": [
    {
      "ID": "V1",
      "TEXT": "Verify changed-file set equals TOUCH_SET."
    }
  ],
  "ECONOMY_BUDGET": {
    "MAX_EXECUTIONS": 1,
    "MAX_RETRIES": 0,
    "MAX_REPAIRS": 0,
    "MAX_PARALLELISM": 1
  },
  "INTERVENTION_POLICY": "BLOCK_ON_AMBIGUITY",
  "REPLAN_BOUNDARY": "TASK_ONLY",
  "EXPECTED_OUTPUTS": [
    {
      "ID": "O1",
      "TEXT": "Candidate commit or draft-PR identity if separately approved and executed."
    }
  ],
  "EXPECTED_EVIDENCE": [
    {
      "ID": "E1",
      "TEXT": "Exact source head, candidate head and changed-file evidence."
    }
  ],
  "CONTRACT_VERSION": "1.0.0",
  "TASK_CONTRACT_HASH": "64884427a6765376acf7de8ba6d17c2be41b19d8a98b8e428089ca6bd3283111"
}
